{
  "schemaVersion" : "matching.m12.architecture.v1",
  "status" : "PASS",
  "m11BaselineCommit" : "6997e05cea81cb93b883e882c8d75887d0622a22",
  "m11CoreTree" : "58ce86179251a5a8cceba47ff41b1b2657a5d100",
  "headCoreTree" : "58ce86179251a5a8cceba47ff41b1b2657a5d100",
  "matchingCoreByteIdentical" : true,
  "m11GoldensTree" : "3c8cc050be368b7e76ddcbd488a9e06c9d055cc8",
  "headGoldensTree" : "3c8cc050be368b7e76ddcbd488a9e06c9d055cc8",
  "m11GoldensByteIdentical" : true,
  "m11WireSourcesByteIdentical" : true,
  "m11WireSourceSha256" : {
    "matching-cluster-runtime/src/main/java/io/github/lchareln/cex/matching/cluster/M11CommandRequest.java" : "2d42e7205f6c875738c74c25ec57459d11fea83b42dc184abed8eccba9442294",
    "matching-cluster-runtime/src/main/java/io/github/lchareln/cex/matching/cluster/M11CommandResponse.java" : "f1286e0ee44c6cd7ae6e505f142aa24e5eed378eb66382323d9d5f059b6d4067",
    "matching-cluster-runtime/src/main/java/io/github/lchareln/cex/matching/cluster/M11RequestCodec.java" : "7b72e24eba72da1195e03160482109c25efdc6e768c2c1402018e9fc1b113246",
    "matching-cluster-runtime/src/main/java/io/github/lchareln/cex/matching/cluster/M11ResponseCodec.java" : "37da561944268ed48771dabc8baf02cd020ac677aaf71219b17d612b97fa9ec0",
    "matching-cluster-runtime/src/main/java/io/github/lchareln/cex/matching/cluster/M11Snapshot.java" : "cbe9af8f11403cf672780a9ad4e650dde001e69a47b0ae1e74688f87e705051f",
    "matching-cluster-runtime/src/main/java/io/github/lchareln/cex/matching/cluster/M11SnapshotCodec.java" : "a6bb054a0d307c224db22a52df3980faf05737237bef358a8710b5a22d5e9c5f"
  },
  "m11ClusteredServiceAdapterByteIdentical" : false,
  "m11ClusteredServiceAdapterBaselineSha256" : "293272910404d07ec6a174303104af378e796a004e627585d1e5ae8b88660bc2",
  "m12ClusteredServiceAdapterSha256" : "fa9f0492b12988c026611e983ca72c127efefb4259ea08528a51699fcda6c034",
  "transportAdapterCorrection" : "COMMITTED_RESULT_EGRESS_FAILURE_RECORDED_NOT_THROWN",
  "transportAdapterCorrectionPresent" : true,
  "transportAdapterCorrectionBehaviorTests" : 5,
  "aeronProductionModule" : "matching-cluster-runtime",
  "coreInfrastructureFree" : true,
  "callbackReachableStandaloneWalReferences" : 0,
  "callbackReachableExternalIoReferences" : 0,
  "logCallbackBusinessApplyCalls" : 1,
  "nonLogCallbackBusinessApplyCalls" : 0,
  "runtimeMetadataDigestStable" : true,
  "memberChildMainCount" : 1,
  "externalFaultControllerSites" : 2,
  "clusteredServiceFaultControllerSites" : 0,
  "externalServices" : false,
  "standaloneApplicationWal" : false,
  "violations" : [ ]
}
